{
  "name": "test",
  "role": "script",
  "description": "test for script prompt",
  "system": "You write voiceover narration scripts for YouTube videos.\n{{#persona}}Persona and style:\n{{persona}}\n{{/persona}}\nMake a very good video!",
  "user": "Write the narration script for a video titled: \"{{title}}\".\n{{#target_seconds}}Target length: about {{target_seconds}} seconds of speech (roughly {{target_words}} words).\n{{/target_seconds}}{{#content_rules}}Channel content rules: {{content_rules}}\n{{/content_rules}}{{#instructions}}Per-video instructions: {{instructions}}\n{{/instructions}}Structure it with a hook, a development, and a resolution."
}
